{
    "governance_id": "f5ab2eb6-5afe-4a2a-9010-e52fc7c5b969",
    "schema_version": "1.0.0",
    "created_at_utc": "2026-02-09T15:00:50Z",
    "source": {
        "type": "pilot_feedback",
        "origin_id": "20260208_211002"
    },
    "signal_type": "observation",
    "content": {
        "summary": "Pilot run 20260208_211002 completed successfully",
        "details": "Governance profile: dev. Phase gates: [3, 6, 9] manual approvals recorded."
    },
    "tenant_context": {
        "tenant_id": "genesis_tenant"
    },
    "pii_scrubbed": true
}